{
  "schema_version": 1,
  "name": "historical-iss-sampled-ground-pass",
  "duration_ns": 1200000000000,
  "control_delay_ns": 10000000,
  "nodes": [
    {
      "id": "ue-bluffton",
      "kind": "terminal",
      "latitude_deg": 40.8939,
      "longitude_deg": -83.8917
    },
    {
      "id": "iss-demo",
      "kind": "satellite"
    },
    {
      "id": "gw-bluffton",
      "kind": "ground_station",
      "latitude_deg": 40.8939,
      "longitude_deg": -83.8917
    },
    {
      "id": "pop-demo",
      "kind": "pop"
    },
    {
      "id": "internet",
      "kind": "internet"
    }
  ],
  "links": [
    {
      "id": "user-iss",
      "from": "ue-bluffton",
      "to": "iss-demo",
      "kind": "user_rf",
      "capacity_bps": 100000000,
      "propagation_delay_ns": 3000000,
      "queue_limit_bytes": 4800
    },
    {
      "id": "feeder-iss",
      "from": "iss-demo",
      "to": "gw-bluffton",
      "kind": "feeder",
      "capacity_bps": 200000000,
      "propagation_delay_ns": 3000000,
      "queue_limit_bytes": 4800
    },
    {
      "id": "backhaul-iss",
      "from": "gw-bluffton",
      "to": "pop-demo",
      "kind": "backhaul",
      "capacity_bps": 1000000000,
      "propagation_delay_ns": 1500000,
      "queue_limit_bytes": 9600
    },
    {
      "id": "pop-iss",
      "from": "pop-demo",
      "to": "internet",
      "kind": "internet",
      "capacity_bps": 1000000000,
      "propagation_delay_ns": 2500000,
      "queue_limit_bytes": 9600
    }
  ],
  "flows": [
    {
      "id": "iss-ground-probe",
      "source": "ue-bluffton",
      "destination": "internet",
      "packet_size_bytes": 1200,
      "packet_count": 240,
      "start_ns": 0,
      "interval_ns": 5000000000
    }
  ],
  "faults": []
}
