{
  "schema_version": 1,
  "name": "sampled-contact-handover",
  "duration_ns": 250000000,
  "control_delay_ns": 5000000,
  "nodes": [
    {
      "id": "ue-a",
      "kind": "terminal",
      "latitude_deg": 31.2,
      "longitude_deg": 121.5
    },
    {
      "id": "sat-a",
      "kind": "satellite"
    },
    {
      "id": "sat-b",
      "kind": "satellite"
    },
    {
      "id": "sat-c",
      "kind": "satellite"
    },
    {
      "id": "gw-a",
      "kind": "ground_station",
      "latitude_deg": 30.3,
      "longitude_deg": 120.2
    },
    {
      "id": "pop-a",
      "kind": "pop"
    },
    {
      "id": "internet",
      "kind": "internet"
    }
  ],
  "links": [
    {
      "id": "user-ue-a",
      "from": "ue-a",
      "to": "sat-a",
      "kind": "user_rf",
      "capacity_bps": 100000000,
      "propagation_delay_ns": 2000000,
      "queue_limit_bytes": 4800
    },
    {
      "id": "user-ue-c",
      "from": "ue-a",
      "to": "sat-c",
      "kind": "user_rf",
      "capacity_bps": 100000000,
      "propagation_delay_ns": 2700000,
      "queue_limit_bytes": 4800
    },
    {
      "id": "isl-a-b",
      "from": "sat-a",
      "to": "sat-b",
      "kind": "optical_isl",
      "capacity_bps": 1000000000,
      "propagation_delay_ns": 3200000,
      "queue_limit_bytes": 9600
    },
    {
      "id": "isl-c-b",
      "from": "sat-c",
      "to": "sat-b",
      "kind": "optical_isl",
      "capacity_bps": 1000000000,
      "propagation_delay_ns": 3500000,
      "queue_limit_bytes": 9600
    },
    {
      "id": "feeder-b-gw",
      "from": "sat-b",
      "to": "gw-a",
      "kind": "feeder",
      "capacity_bps": 200000000,
      "propagation_delay_ns": 2300000,
      "queue_limit_bytes": 4800
    },
    {
      "id": "backhaul-gw-pop",
      "from": "gw-a",
      "to": "pop-a",
      "kind": "backhaul",
      "capacity_bps": 1000000000,
      "propagation_delay_ns": 1500000,
      "queue_limit_bytes": 9600
    },
    {
      "id": "pop-internet",
      "from": "pop-a",
      "to": "internet",
      "kind": "internet",
      "capacity_bps": 1000000000,
      "propagation_delay_ns": 2500000,
      "queue_limit_bytes": 9600
    }
  ],
  "flows": [
    {
      "id": "handover-flow",
      "source": "ue-a",
      "destination": "internet",
      "packet_size_bytes": 1200,
      "packet_count": 12,
      "start_ns": 0,
      "interval_ns": 20000000
    }
  ],
  "contacts": [
    {
      "link_id": "user-ue-a",
      "start_ns": 0,
      "end_ns": 100000000,
      "propagation_delay_ns": 1800000
    },
    {
      "link_id": "isl-a-b",
      "start_ns": 0,
      "end_ns": 110000000,
      "propagation_delay_ns": 3200000
    },
    {
      "link_id": "user-ue-c",
      "start_ns": 90000000,
      "end_ns": 230000000,
      "propagation_delay_ns": 2600000
    },
    {
      "link_id": "isl-c-b",
      "start_ns": 90000000,
      "end_ns": 235000000,
      "propagation_delay_ns": 3500000
    }
  ],
  "faults": []
}
